{
  "schemaVersion": 1,
  "attemptId": "attempt-002",
  "runId": "run-aepi-10-001",
  "workItemKey": "PROJ-10",
  "sequence": 2,
  "executorType": "agent",
  "executorId": "implementation-agent",
  "outcome": "passed",
  "interventionRequired": false,
  "startedAt": "2026-07-24T16:00:12Z",
  "finishedAt": "2026-07-24T16:00:22Z",
  "telemetryRef": "events.jsonl#eventSequence=7-11"
}
